{
  "chat": {
    "ask": "追问",
    "askContent": "对刚学的内容有什么问题？",
    "chatInputPlaceholder": "有什么想问的？",
    "chatInputWarn": "请输入问题",
    "chatTips": "内容由 AI 大模型生成，无法确保真实准确，仅供学习参考",
    "copySuccess": "已复制到剪切板",
    "copyText": "复制",
    "loginSuccess": "已经登录成功了",
    "startAutoSkip": "开启自动跳过",
    "stopAutoSkip": "停止自动跳过"
  },
  "common": {
    "backToHome": "返回首页",
    "collapseExpand": "折叠/展开",
    "companyAddress": "北京朝阳区望京东煌大厦19层163室",
    "companyName": "北京潺潺山木科技有限公司",
    "expandCollapse": "展开/折叠",
    "networkError": "无法连接到服务器，请检查网络设置",
    "ok": "确定",
    "redirectInSeconds": "将在 {{seconds}} 秒后返回首页",
    "settings": "设置",
    "shortcut": {
      "key": {
        "/": "/",
        "a": "A",
        "b": "B",
        "c": "C",
        "cmd": "⌘",
        "ctrl": "Ctrl",
        "d": "D",
        "e": "E",
        "enter": "回车",
        "shift": "Shift",
        "space": "空格"
      },
      "title": {
        "ask": "追问",
        "continue": "继续（无需用户输入或选择时）",
        "shortcut": "显示快捷方式"
      }
    },
    "waitingForCompletion": "敬请期待"
  },
  "error": {
    "pageNotFound": "找不到这个师傅了"
  },
  "feedback": {
    "feedbackContactEmpty": "联系方式不能为空",
    "feedbackContent": "反馈内容",
    "feedbackContentEmpty": "反馈内容不能为空",
    "feedbackFail": "反馈失败",
    "feedbackPlaceholder": "请输入反馈内容",
    "feedbackSubmit": "提交",
    "feedbackSuccess": "反馈成功，感谢你的反馈。",
    "feedbackTitle": "反馈"
  },
  "groupon": {
    "grouponInputMsg": "请输入兑换码",
    "grouponModify": "修改兑换码 >",
    "grouponPlaceholder": "请输入兑换码",
    "grouponTitle": "兑换码",
    "grouponUse": "其他支付方式"
  },
  "lesson": {
    "lessonStatus": {
      "completed": "已完成",
      "learning": "正在学",
      "locked": "未解锁",
      "notStart": "未开始",
      "prepareLearning": "可学习"
    },
    "reset": {
      "resetConfirmContent": "重修会清空当前学习数据。确定重修？",
      "resetConfirmTitle": "确认重修",
      "resetTitle": "重修"
    }
  },
  "menus": {
    "navigationMenus": {
      "basicInfo": "用户信息",
      "language": "语言",
      "personalInfo": "个性化设置"
    }
  },
  "navigation": {
    "contactUs": "联系我们",
    "courseList": "课程名称",
    "feedbackTitle": "提交反馈",
    "filing": "备案",
    "gongan": "京公网安备11010502055644号",
    "icp": "京ICP备2024076754号-2",
    "memberSetting": "会员管理",
    "privacyPolicy": "隐私政策",
    "settings": "设置",
    "shortcut": "快捷键",
    "skin": "皮肤",
    "theChapter": "章",
    "theLesson": "节",
    "userAgreement": "服务协议"
  },
  "pay": {
    "modelServiceAgreement": "《模型服务协议》",
    "payChannel": "支付方式",
    "payChannelAlipay": "支付宝",
    "payChannelWechat": "微信",
    "payModalTitle": "购买",
    "paySuccess": "支付成功",
    "protocolDesc": "购买即表示已阅读并同意以下协议",
    "userPrivacyPolicy": "《用户隐私协议》",
    "virtualProductDesc": "说明：",
    "virtualProductPoint1": "1. 购买即表示已阅读并同意{{modelServiceAgreement}}和{{userPrivacyPolicy}}。",
    "virtualProductPoint2": "2. 你购买的商品为虚拟商品，购买后不支持退订、转让。"
  },
  "settings": {
    "basicInfo": "基础信息",
    "birth": "生日",
    "birthPlaceholder": "请选择生日",
    "dialogTitle": {
      "selectBirthday": "选择生日",
      "selectSex": "选择性别"
    },
    "home": "主页",
    "nickname": "昵称",
    "nicknamePersonal": "昵称（同时作为个人基本信息）",
    "nicknamePlaceholder": "请输入昵称",
    "personalInfo": "个性化设置",
    "settingTite": "个人信息",
    "sex": "性别",
    "sexPlaceholder": "请选择性别"
  },
  "user": {
    "confirmLogoutContent": "确认退出登录吗？",
    "confirmLogoutTitle": "确认退出登录？",
    "defaultUserName": "默认名称",
    "login": "登录",
    "loginFeedback": "提交反馈",
    "loginMainButton": "登录/注册",
    "loginTitle": "登录",
    "logout": "退出登录",
    "msgAgreement": "服务协议",
    "msgAnd": "&",
    "msgCheckCode": "图形验证码",
    "msgHaveRead": "我已阅读并同意",
    "msgLoginProblem": "登录遇到问题",
    "msgLoginSuccess": "登录成功",
    "msgPhonePlaceHolder": "请输入手机号",
    "msgPrivacyPolicy": "隐私政策",
    "msgResendCode": "重新发送",
    "msgToAgree": "请勾选同意协议",
    "msgToCheckAgreement": "请勾选同意协议",
    "msgToInputCode": "请输入4位短信验证码",
    "msgToInputCode4": "请输入4位验证码",
    "msgToInputPhone": "请输入11位手机号",
    "msgToInputPwd": "请输入密码",
    "mstPhoneReg": "手机号格式不正确",
    "notLogin": "未登录",
    "sex": {
      "female": "女性",
      "male": "男性",
      "secret": "保密"
    }
  }
}
