{
  "chat": {
    "ask": "Ask",
    "askContent": "Any questions about what you just learned?",
    "chatInputPlaceholder": "What's your question?",
    "chatInputWarn": "Please enter a question",
    "chatTips": "Content is generated by AI large model, cannot guarantee accuracy, for learning reference only",
    "copySuccess": "Copied to clipboard",
    "copyText": "Copy",
    "loginSuccess": "Login successful",
    "startAutoSkip": "Start Auto Skip",
    "stopAutoSkip": "Stop Auto Skip"
  },
  "common": {
    "backToHome": "Back to Home",
    "collapseExpand": "Collapse/Expand",
    "companyAddress": "Room 163,19th Floor,Wangjing Donghuang Building,Chaoyang District,Beijing",
    "companyName": "Beijing Chanchan Shanmu Technology Co., Ltd.",
    "expandCollapse": "Expand/Collapse",
    "networkError": "Unable to connect to the server, please check the network settings",
    "ok": "OK",
    "redirectInSeconds": "Redirecting to home in {{seconds}} seconds",
    "settings": "Settings",
    "shortcut": {
      "key": {
        "/": "/",
        "a": "A",
        "b": "B",
        "c": "C",
        "cmd": "âŒ˜",
        "ctrl": "Ctrl",
        "d": "D",
        "e": "E",
        "enter": "Enter",
        "shift": "Shift",
        "space": "Space"
      },
      "title": {
        "ask": "Ask follow-up questions",
        "continue": "Continue (when no input or selection required)",
        "shortcut": "Display Shortcuts"
      }
    },
    "waitingForCompletion": "Coming Soon"
  },
  "error": {
    "pageNotFound": "Sorry, this Shifu is missing..."
  },
  "feedback": {
    "feedbackContactEmpty": "Contact information cannot be empty",
    "feedbackContent": "Feedback Content",
    "feedbackContentEmpty": "Feedback content cannot be empty",
    "feedbackFail": "Feedback submission failed",
    "feedbackPlaceholder": "Enter feedback content",
    "feedbackSubmit": "Submit",
    "feedbackSuccess": "Feedback submitted successfully. Thank you for your feedback.",
    "feedbackTitle": "Feedback"
  },
  "groupon": {
    "grouponInputMsg": "Enter the Voucher Code",
    "grouponModify": "Modify Voucher Code >",
    "grouponPlaceholder": "Enter the Voucher Code",
    "grouponTitle": "Voucher Code",
    "grouponUse": "Use Voucher Code >"
  },
  "lesson": {
    "lessonStatus": {
      "completed": "Done",
      "learning": "In Process",
      "locked": "Locked",
      "notStart": "Not Start",
      "prepareLearning": "Ready"
    },
    "reset": {
      "resetConfirmContent": "Resetting will clear your current learning data. Confirm reset?",
      "resetConfirmTitle": "Confirm Reset",
      "resetTitle": "Reset"
    }
  },
  "menus": {
    "navigationMenus": {
      "basicInfo": "Basic Information",
      "language": "Language",
      "personalInfo": "Personalized Information"
    }
  },
  "navigation": {
    "contactUs": "Contact Us",
    "courseList": "Course Name",
    "feedbackTitle": "Submit Feedback",
    "filing": "Registration",
    "gongan": "Beijing Public Security No.11010502055644 ",
    "icp": "Beijing ICP No.2024076754 -2",
    "memberSetting": "Membership Management",
    "privacyPolicy": "Privacy Policy",
    "settings": "Settings",
    "shortcut": "Shortcut",
    "skin": "Skin",
    "theChapter": " Chapter",
    "theLesson": " Lesson",
    "userAgreement": "Service Agreement"
  },
  "pay": {
    "modelServiceAgreement": "Model Service Agreement",
    "payChannel": "Payment Method",
    "payChannelAlipay": "Alipay",
    "payChannelWechat": "WeChat",
    "payModalTitle": "Purchase",
    "paySuccess": "Paid successfully",
    "protocolDesc": "Purchase means you have read and agreed to the following agreement",
    "userPrivacyPolicy": "User Privacy Policy",
    "virtualProductDesc": "Notes:",
    "virtualProductPoint1": "1. By completing this purchase, you acknowledge that you have read and accept {{modelServiceAgreement}} and {{userPrivacyPolicy}}.",
    "virtualProductPoint2": "2. This purchase is for digital content; once the transaction is finalized, no refunds or transfers will be permitted."
  },
  "settings": {
    "basicInfo": "Basic Info",
    "birth": "Birthday",
    "birthPlaceholder": "Please select your birthday",
    "dialogTitle": {
      "selectBirthday": "Select Birthday",
      "selectSex": "Select Gender"
    },
    "home": "Home",
    "nickname": "Nickname",
    "nicknamePersonal": "Nickname",
    "nicknamePlaceholder": "Please enter your nickname",
    "personalInfo": "Personalized Information",
    "settingTite": "Profile",
    "sex": "Gender",
    "sexPlaceholder": "Please select your gender"
  },
  "user": {
    "confirmLogoutContent": "Are you sure you want to log out?",
    "confirmLogoutTitle": "Confirm logout?",
    "defaultUserName": "Default Name",
    "login": "Login",
    "loginFeedback": "Submit feedback",
    "loginMainButton": "Login/Register",
    "loginTitle": "Login",
    "logout": "Logout",
    "msgAgreement": "The Service Agreement",
    "msgAnd": " and ",
    "msgCheckCode": "Image verification code",
    "msgHaveRead": "I have read and agreed to ",
    "msgLoginProblem": "Encountering login problems",
    "msgLoginSuccess": "Login successful",
    "msgPhonePlaceHolder": "Please enter an 11-digit phone number",
    "msgPrivacyPolicy": "The Privacy Policy",
    "msgResendCode": "Resend",
    "msgToAgree": "Please check to agree to the terms",
    "msgToCheckAgreement": "Please check to agree to the terms ",
    "msgToInputCode": "Enter SMS Verification Code",
    "msgToInputCode4": "Enter Verification Code",
    "msgToInputPhone": "Enter phone number",
    "msgToInputPwd": "Enter the password",
    "mstPhoneReg": "Invalid phone number format",
    "notLogin": "Not logged in",
    "sex": {
      "female": "Female",
      "male": "Male",
      "secret": "Secret"
    }
  }
}
